[
  {
    "schema_version": "problem_bank_record.v1",
    "id": "tal_scq5k:zh_train:algebra:level_5:02431",
    "source": {
      "name": "TAL-SCQ5K",
      "dataset_id": "math-eval/TAL-SCQ5K",
      "source_url": "https://raw.githubusercontent.com/math-eval/TAL-SCQ5K/main/ch_single_choice_constructed_5K/ch_single_choice_train_3K.jsonl",
      "license": "MIT",
      "original_index": 2431,
      "split": "zh_train",
      "source_problem_id": "074e77d8f25d4d75b1914287179a1d81"
    },
    "content": {
      "language": "zh",
      "problem_latex": "小王沿街匀速行走，发现每隔$$6$$分钟从背后驶过一辆$$18$$路公交车，每隔$$3$$分钟从迎面驶来一辆$$18$$路公交车．假设每辆$$18$$路公交车行驶速度相同，而且$$18$$路公交车总站每隔固定时间发一辆车，那么发车间隔的时间是~\\uline{~~~~~~~~~~}~分钟．\n(A) 2\n(B) 3\n(C) 6\n(D) 4",
      "problem_plain": "小王沿街匀速行走，发现每隔 6 分钟从背后驶过一辆 18 路公交车，每隔 3 分钟从迎面驶来一辆 18 路公交车．假设每辆 18 路公交车行驶速度相同，而且 18 路公交车总站每隔固定时间发一辆车，那么发车间隔的时间是~ ~~~~~~~~~~ ~分钟． (A) 2 (B) 3 (C) 6 (D) 4",
      "solution_latex": "设$$18$$路公交车的速度是$$x$$米/分，小王行走的速度是$$y$$米/分，同向行驶的相邻两车的间距为$$s$$米．  每隔$$6$$分钟从背后开过一辆$$18$$路公交车，则  $$6x-6y=s$$．①  每隔$$3$$分钟从迎面驶来一辆$$18$$路公交车，则  $$3x+3y=s$$．②  由①②得，$$s=4x$$，所以$$\\frac{s}{x}=4$$.  即$$18$$路公交车总站发车间隔的时间是$$4$$分钟．",
      "solution_plain": "设 18 路公交车的速度是 x 米/分，小王行走的速度是 y 米/分，同向行驶的相邻两车的间距为 s 米． 每隔 6 分钟从背后开过一辆 18 路公交车，则 6x-6y=s ．① 每隔 3 分钟从迎面驶来一辆 18 路公交车，则 3x+3y=s ．② 由①②得， s=4x ，所以 s x =4 . 即 18 路公交车总站发车间隔的时间是 4 分钟．"
    },
    "answer": {
      "final_raw": "4",
      "final_normalized": "4",
      "candidates": [
        "4",
        "D"
      ],
      "extraction_method": "tal_answer_option",
      "answer_type": "integer"
    },
    "taxonomy": {
      "domain": "competition_math",
      "subject": "Algebra",
      "subject_slug": "algebra",
      "level": "Level 5",
      "level_number": 5,
      "grade_band": "high",
      "concepts": [
        "unknown"
      ],
      "tags": [
        "algebra",
        "level_5",
        "single_choice",
        "tal_scq5k",
        "unknown",
        "zh",
        "zh_train"
      ]
    },
    "structure": {
      "format": "multiple_choice_latex_text",
      "has_asy": false,
      "has_diagram": false,
      "has_table": false,
      "has_choices": true,
      "requires_rendering": true
    },
    "learning": {
      "prerequisites": [],
      "step_outline": [
        "设$$18$$路公交车的速度是$$x$$米/分，小王行走的速度是$$y$$米/分，同向行驶的相邻两车的间距为$$s$$米．  每隔$$6$$分钟从背后开过一辆$$18$$路公交车，则  $$6x-6y=s$$．①  每隔$$3$$分钟从迎面驶来一辆$$18$$路公交车，则  $$3x+3y=s$$．②  由①②得，$$s=4x$$，所以$$\\frac{s}{x}=4$$.",
        "即$$18$$路公交车总站发车间隔的时间是$$4$$分钟．"
      ],
      "hints": [],
      "common_mistakes": []
    },
    "search": {
      "problem_text": "小王沿街匀速行走，发现每隔 6 分钟从背后驶过一辆 18 路公交车，每隔 3 分钟从迎面驶来一辆 18 路公交车．假设每辆 18 路公交车行驶速度相同，而且 18 路公交车总站每隔固定时间发一辆车，那么发车间隔的时间是~ ~~~~~~~~~~ ~分钟． (A) 2 (B) 3 (C) 6 (D) 4",
      "solution_text": "设 18 路公交车的速度是 x 米/分，小王行走的速度是 y 米/分，同向行驶的相邻两车的间距为 s 米． 每隔 6 分钟从背后开过一辆 18 路公交车，则 6x-6y=s ．① 每隔 3 分钟从迎面驶来一辆 18 路公交车，则 3x+3y=s ．② 由①②得， s=4x ，所以 s x =4 . 即 18 路公交车总站发车间隔的时间是 4 分钟．",
      "keywords": [
        "algebra",
        "level_5",
        "single_choice",
        "tal_scq5k",
        "unknown",
        "zh",
        "zh_train"
      ]
    },
    "metadata": {
      "created_at": "2026-04-25T04:57:08+00:00",
      "updated_at": "2026-04-25T04:57:08+00:00",
      "quality": {
        "solution_available": true,
        "final_answer_extracted": true,
        "needs_review": false,
        "review_reasons": []
      },
      "tal_scq5k": {
        "qid": "74",
        "queId": "074e77d8f25d4d75b1914287179a1d81",
        "difficulty": "4",
        "answer_value": "D",
        "choices": [
          {
            "label": "A",
            "content": "2"
          },
          {
            "label": "B",
            "content": "3"
          },
          {
            "label": "C",
            "content": "6"
          },
          {
            "label": "D",
            "content": "4"
          }
        ],
        "knowledge_point_routes": [
          "课内体系->知识点->方程与不等式->二元一次方程（组）->二元一次方程组应用题->二元一次方程组的行程问题"
        ],
        "competition_source_list": [
          "2016~2017学年10月河南郑州二七区郑州实验外国语中学初一上学期月考第11题3分",
          "2008年竞赛第7题6分",
          "2016~2017学年福建泉州南安市南安市实验中学初一下学期期中第16题4分",
          "2018~2019学年浙江杭州西湖区杭州市之江实验中学初一下学期期末第18题4分"
        ]
      }
    }
  }
]