[
  {
    "schema_version": "problem_bank_record.v1",
    "id": "tal_scq5k:en_test:algebra:level_4:00786",
    "source": {
      "name": "TAL-SCQ5K",
      "dataset_id": "math-eval/TAL-SCQ5K",
      "source_url": "https://raw.githubusercontent.com/math-eval/TAL-SCQ5K/main/en_single_choice_constructed_5K/en_single_choice_test_2K.jsonl",
      "license": "MIT",
      "original_index": 786,
      "split": "en_test",
      "source_problem_id": "0202e05a6b15404da9ba862b714faeb5"
    },
    "content": {
      "language": "en",
      "problem_latex": "When the price of bananas increases by 20\\%, the quantity demanded of apples increases by 30\\%. What is the value of the cross-price elasticity of demand?\n(A) 0\n(B) -1.5\n(C) 2/3\n(D) 1.5\n(E) -2/3",
      "problem_plain": "When the price of bananas increases by 20 %, the quantity demanded of apples increases by 30 %. What is the value of the cross-price elasticity of demand? (A) 0 (B) -1.5 (C) 2/3 (D) 1.5 (E) -2/3",
      "solution_latex": "",
      "solution_plain": ""
    },
    "answer": {
      "final_raw": "1.5",
      "final_normalized": "1.5",
      "candidates": [
        "1.5",
        "D"
      ],
      "extraction_method": "tal_answer_option",
      "answer_type": "decimal"
    },
    "taxonomy": {
      "domain": "competition_math",
      "subject": "Algebra",
      "subject_slug": "algebra",
      "level": "Level 4",
      "level_number": 4,
      "grade_band": "middle",
      "concepts": [
        "basic_concepts_of_equation",
        "calculation_modules"
      ],
      "tags": [
        "algebra",
        "basic_concepts_of_equation",
        "calculation_modules",
        "en",
        "en_test",
        "level_4",
        "single_choice",
        "tal_scq5k"
      ]
    },
    "structure": {
      "format": "multiple_choice_latex_text",
      "has_asy": false,
      "has_diagram": false,
      "has_table": false,
      "has_choices": true,
      "requires_rendering": false
    },
    "learning": {
      "prerequisites": [],
      "step_outline": [],
      "hints": [],
      "common_mistakes": []
    },
    "search": {
      "problem_text": "When the price of bananas increases by 20 %, the quantity demanded of apples increases by 30 %. What is the value of the cross-price elasticity of demand? (A) 0 (B) -1.5 (C) 2/3 (D) 1.5 (E) -2/3",
      "solution_text": "",
      "keywords": [
        "algebra",
        "basic_concepts_of_equation",
        "calculation_modules",
        "en",
        "en_test",
        "level_4",
        "single_choice",
        "tal_scq5k"
      ]
    },
    "metadata": {
      "created_at": "2026-04-25T04:57:08+00:00",
      "updated_at": "2026-04-25T04:57:08+00:00",
      "quality": {
        "solution_available": false,
        "final_answer_extracted": true,
        "needs_review": true,
        "review_reasons": [
          "missing_answer_analysis"
        ]
      },
      "tal_scq5k": {
        "qid": "2672",
        "queId": "0202e05a6b15404da9ba862b714faeb5",
        "difficulty": "3",
        "answer_value": "D",
        "choices": [
          {
            "label": "A",
            "content": "0"
          },
          {
            "label": "B",
            "content": "-1.5"
          },
          {
            "label": "C",
            "content": "2/3"
          },
          {
            "label": "D",
            "content": "1.5"
          },
          {
            "label": "E",
            "content": "-2/3"
          }
        ],
        "knowledge_point_routes": [
          "Overseas Competition->Knowledge Point->Calculation Modules->Basic Concepts of Equation"
        ],
        "competition_source_list": [
          "其它"
        ]
      }
    }
  },
  {
    "schema_version": "problem_bank_record.v1",
    "id": "tal_scq5k:en_test:algebra:level_4:01272",
    "source": {
      "name": "TAL-SCQ5K",
      "dataset_id": "math-eval/TAL-SCQ5K",
      "source_url": "https://raw.githubusercontent.com/math-eval/TAL-SCQ5K/main/en_single_choice_constructed_5K/en_single_choice_test_2K.jsonl",
      "license": "MIT",
      "original_index": 1272,
      "split": "en_test",
      "source_problem_id": "8bee20013c96417ba61f90e45dfba5e9"
    },
    "content": {
      "language": "en",
      "problem_latex": "Simplify：$$(x+3)(x+4)$$．\n(A) x^{2}+7x+12\n(B) x^{2}+5x+12\n(C) x^{2}+2x+12\n(D) x^{2}+12",
      "problem_plain": "Simplify： (x+3)(x+4) ． (A) x^ 2 +7x+12 (B) x^ 2 +5x+12 (C) x^ 2 +2x+12 (D) x^ 2 +12",
      "solution_latex": "",
      "solution_plain": ""
    },
    "answer": {
      "final_raw": "x^{2}+7x+12",
      "final_normalized": "x^{2}+7x+12",
      "candidates": [
        "A",
        "x^{2}+7x+12"
      ],
      "extraction_method": "tal_answer_option",
      "answer_type": "expression"
    },
    "taxonomy": {
      "domain": "competition_math",
      "subject": "Algebra",
      "subject_slug": "algebra",
      "level": "Level 4",
      "level_number": 4,
      "grade_band": "middle",
      "concepts": [
        "algebraic_expressions",
        "basic_concepts_of_equation",
        "calculation_modules",
        "equivalent_substitution"
      ],
      "tags": [
        "algebra",
        "algebraic_expressions",
        "basic_concepts_of_equation",
        "calculation_modules",
        "en",
        "en_test",
        "equivalent_substitution",
        "level_4",
        "single_choice",
        "tal_scq5k"
      ]
    },
    "structure": {
      "format": "multiple_choice_latex_text",
      "has_asy": false,
      "has_diagram": false,
      "has_table": false,
      "has_choices": true,
      "requires_rendering": true
    },
    "learning": {
      "prerequisites": [],
      "step_outline": [],
      "hints": [],
      "common_mistakes": []
    },
    "search": {
      "problem_text": "Simplify： (x+3)(x+4) ． (A) x^ 2 +7x+12 (B) x^ 2 +5x+12 (C) x^ 2 +2x+12 (D) x^ 2 +12",
      "solution_text": "",
      "keywords": [
        "algebra",
        "algebraic_expressions",
        "basic_concepts_of_equation",
        "calculation_modules",
        "en",
        "en_test",
        "equivalent_substitution",
        "level_4",
        "single_choice",
        "tal_scq5k"
      ]
    },
    "metadata": {
      "created_at": "2026-04-25T04:57:08+00:00",
      "updated_at": "2026-04-25T04:57:08+00:00",
      "quality": {
        "solution_available": false,
        "final_answer_extracted": true,
        "needs_review": true,
        "review_reasons": [
          "missing_answer_analysis"
        ]
      },
      "tal_scq5k": {
        "qid": "4484",
        "queId": "8bee20013c96417ba61f90e45dfba5e9",
        "difficulty": "3",
        "answer_value": "A",
        "choices": [
          {
            "label": "A",
            "content": "x^{2}+7x+12"
          },
          {
            "label": "B",
            "content": "x^{2}+5x+12"
          },
          {
            "label": "C",
            "content": "x^{2}+2x+12"
          },
          {
            "label": "D",
            "content": "x^{2}+12"
          }
        ],
        "knowledge_point_routes": [
          "Overseas Competition->Knowledge Point->Calculation Modules->Basic Concepts of Equation->Equivalent Substitution->Algebraic Expressions"
        ],
        "competition_source_list": [
          "其它"
        ]
      }
    }
  }
]